incident_id,date,time,plant_location,area,incident_type,severity,description,injured_person,injury_type,lost_days,root_cause,immediate_cause,contributing_factors,corrective_action,preventive_action,reported_by,investigated_by,lessons_learned,status
INC-001,2026-01-08,14:30,Chinchwad Plant,Fabrication Shop — Bay 3,Near Miss,Potential-High,"Overhead crane load (2.5 MT pipe spool) swung unexpectedly during lifting due to improper rigging — missed worker by approximately 1 meter",None,None,0,"Rigger used single-point lift instead of required two-point lift for long spool; spool length 6m exceeded single-point lift limit of 3m","Improper rigging technique; non-compliance with lifting plan","Rigger not trained in new lifting procedure (updated Nov-2025); supervisor absent from lift area; no pre-lift toolbox talk conducted","Rigger retrained and re-certified; supervisor counseled; lifting plan compliance made mandatory checkpoint before any crane operation","Implement mandatory pre-lift checklist signed by rigger AND supervisor; install camera monitoring on all overhead cranes; monthly rigging audit",Crane Operator R. Patil,EHS Manager V. Desai,"Single-point vs two-point lift decision MUST be part of pre-lift toolbox talk; supervisor presence is non-negotiable for loads >1 MT",Closed
INC-002,2026-01-22,09:15,Savli Plant,Boiler House — Economizer Area,First Aid,Low,"Technician received minor steam burn on left forearm while opening inspection port on economizer during running boiler inspection; steam leak from deteriorated gasket around port",Amit Ghosh (EMP-1205),Minor burn — first degree; 5cm area on left forearm,0,"Inspection port gasket had deteriorated beyond acceptable condition; gasket replacement was overdue by 2 months per PM schedule","Opening inspection port without verifying gasket condition; not wearing heat-resistant arm guards (required PPE for this task)","PM schedule adherence gap; PPE compliance not checked before task start","Gasket replaced; all economizer inspection port gaskets inspected and replaced where needed; burn treated at plant first-aid center","Add gasket condition check to pre-task checklist for economizer inspection; enforce arm guard PPE through mandatory PPE checkpoint before entering boiler house",Shift Supervisor S. Nair,EHS Officer P. Sawant,"Gasket condition is a leading indicator for steam leak risk — must be tracked in PM system with no tolerance for overdue replacement",Closed
INC-003,2026-02-14,11:45,Client Site — Dalmia Ariyalur,Erection Area — Column Foundation,LTI (Lost Time Injury),High,"Erection helper fell 3 meters from scaffold platform while positioning a structural column bracket; safety harness was worn but not hooked to anchor point. Sustained fracture of right wrist and bruised ribs.",Manoj Kumar (Contract Worker — L&T),Fracture right wrist + bruised ribs,21,"Worker unhooked harness lanyard to move to adjacent scaffold bay where no anchor point was available; anchor points not extended to cover new scaffold extension","Working at height without fall protection connected; gap in anchor point coverage on extended scaffold","Scaffold extension was added previous day without corresponding anchor point installation; site supervisor did not inspect scaffold before work commenced","Worker hospitalized and treated; scaffold inspected and anchor points installed at all bays; 100% scaffold inspection before work clearance implemented; L&T issued show-cause to their site supervisor","Implement scaffold handover checklist with mandatory anchor point verification; install retractable lifeline systems on all scaffolds >2m; daily pre-shift scaffold inspection by EHS",L&T Site Supervisor,EHS Manager V. Desai + L&T EHS,"CRITICAL: Scaffold modifications MUST trigger re-inspection before any work clearance. Anchor point coverage must be 100% — zero tolerance for gaps.",Closed — Monitoring
INC-004,2026-03-05,16:20,Chinchwad Plant,Chemical Storage Area,Environmental Spill,Medium,"Approximately 200 liters of phosphate-based boiler water treatment chemical leaked from a damaged IBC container due to forklift puncture during handling. Chemical entered floor drain before containment.",None,None,0,"Forklift tine punctured IBC wall during positioning in storage rack; forklift operator was using incorrect fork attachment for IBC handling","Wrong fork attachment used; IBC placement too tight in rack allowing minimal clearance","Storage area layout not reviewed after recent racking modification; forklift operators not briefed on clearance requirements for new rack configuration","Spill contained using absorbent materials; floor drain blocked to prevent environmental release; affected drain section flushed and neutralized; IBC replaced; area cleaned and tested",Install IBC-specific fork attachments on designated forklift; revise storage rack spacing for minimum 150mm side clearance; install secondary containment bunds around chemical storage; chemical spill drill quarterly,Stores Supervisor,EHS Manager V. Desai,"Chemical spill response was delayed by 8 minutes because spill kit was located 50m away. Relocate spill kits to within 10m of all chemical storage areas.",Closed
INC-005,2026-03-18,08:00,Savli Plant,Main Gate — Entry Road,Vehicle Incident,Medium,"Loaded truck entering plant hit security barrier arm while gate was being raised; barrier arm broke and struck the security guard cabin. Guard was inside cabin and was startled but uninjured.",None (guard uninjured),None,0,"Truck driver accelerated before barrier was fully raised; driver was unfamiliar with plant entry procedure (first-time visitor)","Driver impatience; no physical stop barrier before the automatic arm barrier","Vehicle entry SOP does not include physical wheel stop; no speed breaker before barrier; guard relied on visual signal which driver missed","Barrier repaired; driver counseled; temporary manual barrier control implemented until speed management solution installed","Install speed breakers 20m before barrier; add traffic lights (red/green) visible to drivers; install wheel stops that lower only when barrier is fully up; add driver induction video at gate for first-time visitors",Security Supervisor,Admin Manager + EHS,"Gate entry sequence needs engineering controls not just procedural controls. Human error at vehicle entry points is predictable and must be designed out.",Open — Corrective Actions In Progress
