deal_id,account,competitor,competitor_offering,competitor_price_cr,thermax_price_cr,thermax_advantage,thermax_disadvantage,win_probability,strategy
OPP-101,Tata Steel,L&T,"Full EPC WHRS package with O&M; leveraging existing relationship at Jamshedpur",195,185,"10% lower cost; faster delivery by 3 months; proven WHRS track record at similar BF sizes","L&T has larger EPC brand recognition; deeper Tata relationship at corporate level",60%,Emphasize technical superiority and lifecycle cost advantage
OPP-102,UltraTech Cement,ISGEC,"WHRS package with bag filter; competitive on price but longer lead time",115,120,"Better performance guarantees; integrated bag filter design; Thermax service proximity in Rajasthan","5% premium pricing; ISGEC offers more flexible payment terms",75%,Offer extended warranty and performance-linked pricing to justify premium
OPP-103,Reliance Industries,Linde / L&T,"Linde for hydrogen technology; L&T for utility island EPC",360,340,"Integrated energy + utility offering; single vendor accountability; proven refinery installations","Linde has proprietary hydrogen tech; L&T has deeper Reliance relationship",35%,Partner with hydrogen technology licensor to strengthen offering
OPP-105,NTPC,BHEL / L&T,"BHEL as PSU preferred vendor for FGD; L&T competitive on EPC scale",290,280,"Competitive pricing; better delivery track record on FGD; limestone-gypsum technology proven at scale","BHEL has PSU preference advantage; longer government procurement cycle favors incumbents",50%,Focus on technical evaluation score and reference plant performance data
OPP-107,Saudi Aramco,Alfa Laval,"Process heater package with heat exchangers; strong ME presence",220,210,"Lower total cost; local fabrication capability in India reduces logistics cost; Thermax ME team proximity","Alfa Laval has stronger brand in process heating in Gulf; longer Aramco vendor history",45%,Leverage India cost advantage and Thermax ME office relationship
