grievance_id,filed_date,employee_name,employee_id,department,location,category,description,assigned_to,investigation_start,resolution_summary,resolution_date,days_to_close,employee_satisfied,escalated,status
GR-001,2026-01-10,Anonymous,N/A,Operations,Chinchwad Plant,Workplace Safety,"Reported that emergency exit on floor 2 of fabrication shop is partially blocked by stored raw materials, creating fire evacuation risk",EHS Manager,2026-01-11,"Materials relocated within 24 hours; area marked with floor markings; monthly audit of emergency exits added to EHS checklist",2026-01-13,3,Yes,No,Closed
GR-002,2026-01-18,Deepak Patil,EMP-1078,Operations,Savli Plant,Compensation & Benefits,"Claims overtime of 18 hours in December 2025 was not included in January salary; payslip shows zero OT hours despite supervisor-approved OT forms submitted",HR Executive,2026-01-19,"Investigation found OT forms were stuck in supervisor's pending approvals in HRMS; forms approved and OT payment processed in February salary with interest",2026-02-05,18,Yes,No,Closed
GR-003,2026-02-05,Anonymous,N/A,Procurement,Pune HQ,Workplace Harassment,"Reports that a senior procurement manager regularly uses inappropriate language and publicly humiliates team members during meetings; 3 specific incidents described",POSH ICC Chair,2026-02-06,"ICC conducted investigation per POSH policy; witness statements corroborated; manager given written warning and mandatory behavioral counseling; situation monitored for 6 months",2026-03-15,38,Partially — wanted stronger action,Yes — escalated to CHRO review,Closed — Monitoring
GR-004,2026-02-20,Kiran Desai,EMP-0934,Engineering,Pune HQ,Career Development,"Feels bypassed for promotion to Senior Design Engineer despite 4 years in role and consistently high ratings (3.8+ for 3 years); less experienced colleague promoted instead",HR Business Partner,2026-02-21,"Review found promotion decision was based on specific project leadership experience; Kiran assigned to lead a new project to build required experience; promotion to be reconsidered in next cycle",2026-03-10,18,Partially — accepted explanation but wants clear criteria,No,Closed — Follow-up Scheduled
GR-005,2026-03-01,Sunita Rao,EMP-1150,Finance,Pune HQ,Work-Life Balance,"Extended work hours (10+ hrs/day regularly) during month-end close; no compensatory time off; affecting personal health and family commitments",HR Head + Finance Controller,2026-03-02,"Finance team restructured to distribute month-end workload; 2 additional temporary resources approved for peak periods; flexible hours policy extended to finance team during close",2026-03-20,19,Yes,No,Closed
GR-006,2026-03-15,Anonymous (Group),N/A,Operations,Savli Plant,Facilities,"Canteen food quality has significantly deteriorated since new vendor took over in January; stale food served twice in March; many employees bringing food from home",Admin Manager,2026-03-16,"Canteen vendor given formal notice with 15 specific quality issues; food quality audit implemented (weekly); vendor on 30-day improvement probation; backup vendor identified",2026-04-01,17,Monitoring,No,Open — Under Monitoring
